{
  "$schema": "https://json-schema.org/draft/2020-12/schema",
  "$id": "https://wardpulse.app/schemas/dashboard_snapshot.schema.json",
  "title": "DashboardSnapshot",
  "type": "object",
  "additionalProperties": false,
  "required": ["generatedAt", "overallStatus", "accounts", "todayTotal", "weekTotal", "monthTotal", "alerts", "watchSummary"],
  "properties": {
    "generatedAt": { "type": "string", "format": "date-time" },
    "overallStatus": { "$ref": "#/$defs/providerStatus" },
    "accounts": {
      "type": "array",
      "items": { "$ref": "#/$defs/providerSnapshot" }
    },
    "todayTotal": { "$ref": "budget_state.schema.json" },
    "weekTotal": { "$ref": "budget_state.schema.json" },
    "monthTotal": { "$ref": "budget_state.schema.json" },
    "alerts": {
      "type": "array",
      "items": {
        "type": "object",
        "additionalProperties": false,
        "required": ["severity", "message"],
        "properties": {
          "severity": { "enum": ["info", "warning", "error"] },
          "message": { "type": "string" }
        }
      }
    },
    "watchSummary": {
      "type": "object",
      "additionalProperties": false,
      "required": ["todayUsedPercent", "weekUsedPercent", "status"],
      "properties": {
        "todayUsedPercent": { "type": ["number", "null"] },
        "weekUsedPercent": { "type": ["number", "null"] },
        "status": { "$ref": "#/$defs/providerStatus" }
      }
    }
  },
  "$defs": {
    "providerStatus": {
      "enum": ["ok", "warning", "error", "rateLimited", "authRequired", "stale", "unknown"]
    },
    "providerKind": {
      "enum": ["openai", "codex", "claude", "cursor", "mock"]
    },
    "creditSource": {
      "enum": ["provider", "promo", "manual", "unknown"]
    },
    "money": {
      "type": "object",
      "additionalProperties": false,
      "required": ["minorUnits", "currency"],
      "properties": {
        "minorUnits": { "type": "integer" },
        "currency": { "type": "string", "pattern": "^[A-Z]{3}$" }
      }
    },
    "nullableMoney": {
      "anyOf": [{ "$ref": "#/$defs/money" }, { "type": "null" }]
    },
    "creditState": {
      "type": "object",
      "additionalProperties": false,
      "required": ["remaining", "granted", "expiresAt", "source"],
      "properties": {
        "remaining": { "$ref": "#/$defs/nullableMoney" },
        "granted": { "$ref": "#/$defs/nullableMoney" },
        "expiresAt": { "type": ["string", "null"], "format": "date-time" },
        "source": { "$ref": "#/$defs/creditSource" }
      }
    },
    "allowanceSource": {
      "enum": ["plan", "purchased"]
    },
    "quantityUnit": {
      "enum": ["tokens", "credits"]
    },
    "quantity": {
      "type": "object",
      "additionalProperties": false,
      "required": ["value", "unit"],
      "properties": {
        "value": { "type": "string", "pattern": "^[0-9]+(?:\\.[0-9]+)?$" },
        "unit": { "$ref": "#/$defs/quantityUnit" }
      }
    },
    "nullableQuantity": {
      "anyOf": [{ "$ref": "#/$defs/quantity" }, { "type": "null" }]
    },
    "allowanceState": {
      "type": "object",
      "additionalProperties": false,
      "required": [
        "id",
        "source",
        "label",
        "usedPercent",
        "used",
        "limit",
        "remaining",
        "windowMinutes",
        "resetsAt",
        "status"
      ],
      "properties": {
        "id": { "type": "string" },
        "source": { "$ref": "#/$defs/allowanceSource" },
        "label": { "type": "string" },
        "usedPercent": { "type": ["number", "null"], "minimum": 0 },
        "used": { "$ref": "#/$defs/nullableQuantity" },
        "limit": { "$ref": "#/$defs/nullableQuantity" },
        "remaining": { "$ref": "#/$defs/nullableQuantity" },
        "unlimited": { "type": "boolean" },
        "windowMinutes": { "type": ["integer", "null"], "minimum": 1 },
        "resetsAt": { "type": ["string", "null"], "format": "date-time" },
        "status": { "$ref": "#/$defs/providerStatus" }
      }
    },
    "modelUsage": {
      "type": "object",
      "additionalProperties": false,
      "required": ["model", "cost", "inputTokens", "outputTokens", "requests"],
      "properties": {
        "model": { "type": "string" },
        "cost": { "$ref": "#/$defs/nullableMoney" },
        "inputTokens": { "type": ["integer", "null"], "minimum": 0 },
        "outputTokens": { "type": ["integer", "null"], "minimum": 0 },
        "requests": { "type": ["integer", "null"], "minimum": 0 }
      }
    },
    "providerErrorSummary": {
      "type": "object",
      "additionalProperties": false,
      "required": ["code", "message"],
      "properties": {
        "code": { "type": "string" },
        "message": { "type": "string" }
      }
    },
    "providerSnapshot": {
      "type": "object",
      "additionalProperties": false,
      "required": [
        "accountId",
        "provider",
        "status",
        "today",
        "week",
        "month",
        "credits",
        "buckets",
        "modelBreakdown",
        "lastSuccessfulSyncAt",
        "lastError"
      ],
      "properties": {
        "accountId": { "type": "string" },
        "provider": { "$ref": "#/$defs/providerKind" },
        "connection": {
          "type": "string",
          "minLength": 1,
          "description": "Owning connection key. Absent on snapshots built before adapters stamped it; alerts then fall back to the provider's plan."
        },
        "status": { "$ref": "#/$defs/providerStatus" },
        "today": { "$ref": "budget_state.schema.json" },
        "week": { "$ref": "budget_state.schema.json" },
        "month": { "$ref": "budget_state.schema.json" },
        "credits": {
          "type": "array",
          "items": { "$ref": "#/$defs/creditState" }
        },
        "allowances": {
          "type": "array",
          "items": { "$ref": "#/$defs/allowanceState" }
        },
        "buckets": {
          "type": "array",
          "items": { "$ref": "usage_bucket.schema.json" }
        },
        "modelBreakdown": {
          "type": "array",
          "items": { "$ref": "#/$defs/modelUsage" }
        },
        "lastSuccessfulSyncAt": { "type": ["string", "null"], "format": "date-time" },
        "lastError": {
          "anyOf": [{ "$ref": "#/$defs/providerErrorSummary" }, { "type": "null" }]
        }
      }
    }
  }
}
