{
  "generatedAt": "2026-06-27T18:42:00Z",
  "overallStatus": "ok",
  "accounts": [
    {
      "accountId": "mock-local",
      "provider": "mock",
      "status": "ok",
      "today": {
        "period": "today",
        "spent": {
          "minorUnits": 1240,
          "currency": "USD"
        },
        "limit": {
          "minorUnits": 5000,
          "currency": "USD"
        },
        "remaining": {
          "minorUnits": 3760,
          "currency": "USD"
        },
        "usedPercent": 24.8,
        "projectedTotal": null,
        "status": "ok"
      },
      "week": {
        "period": "week",
        "spent": {
          "minorUnits": 7130,
          "currency": "USD"
        },
        "limit": {
          "minorUnits": 25000,
          "currency": "USD"
        },
        "remaining": {
          "minorUnits": 17870,
          "currency": "USD"
        },
        "usedPercent": 28.52,
        "projectedTotal": {
          "minorUnits": 22800,
          "currency": "USD"
        },
        "status": "ok"
      },
      "month": {
        "period": "month",
        "spent": {
          "minorUnits": 21210,
          "currency": "USD"
        },
        "limit": {
          "minorUnits": 80000,
          "currency": "USD"
        },
        "remaining": {
          "minorUnits": 58790,
          "currency": "USD"
        },
        "usedPercent": 26.5125,
        "projectedTotal": {
          "minorUnits": 74200,
          "currency": "USD"
        },
        "status": "ok"
      },
      "credits": [
        {
          "remaining": {
            "minorUnits": 1875,
            "currency": "USD"
          },
          "granted": {
            "minorUnits": 2500,
            "currency": "USD"
          },
          "expiresAt": "2026-07-31T00:00:00Z",
          "source": "provider"
        }
      ],
      "buckets": [
        {
          "startAt": "2026-06-27T00:00:00Z",
          "endAt": "2026-06-27T06:00:00Z",
          "cost": {
            "minorUnits": 220,
            "currency": "USD"
          },
          "inputTokens": 30000,
          "outputTokens": 9000,
          "cachedTokens": null,
          "requests": 42,
          "model": "mock-fast",
          "project": null,
          "user": null
        },
        {
          "startAt": "2026-06-27T06:00:00Z",
          "endAt": "2026-06-27T12:00:00Z",
          "cost": {
            "minorUnits": 310,
            "currency": "USD"
          },
          "inputTokens": 28000,
          "outputTokens": 10000,
          "cachedTokens": null,
          "requests": 48,
          "model": "mock-fast",
          "project": null,
          "user": null
        },
        {
          "startAt": "2026-06-27T12:00:00Z",
          "endAt": "2026-06-27T18:00:00Z",
          "cost": {
            "minorUnits": 520,
            "currency": "USD"
          },
          "inputTokens": 45000,
          "outputTokens": 17000,
          "cachedTokens": null,
          "requests": 72,
          "model": "mock-fast",
          "project": null,
          "user": null
        },
        {
          "startAt": "2026-06-27T18:00:00Z",
          "endAt": "2026-06-27T18:42:00Z",
          "cost": {
            "minorUnits": 190,
            "currency": "USD"
          },
          "inputTokens": 17000,
          "outputTokens": 6000,
          "cachedTokens": null,
          "requests": 24,
          "model": "mock-fast",
          "project": null,
          "user": null
        }
      ],
      "modelBreakdown": [
        {
          "model": "mock-fast",
          "cost": {
            "minorUnits": 1240,
            "currency": "USD"
          },
          "inputTokens": 120000,
          "outputTokens": 42000,
          "requests": 186
        }
      ],
      "lastSuccessfulSyncAt": "2026-06-27T18:42:00Z",
      "lastError": null
    }
  ],
  "todayTotal": {
    "period": "today",
    "spent": {
      "minorUnits": 1240,
      "currency": "USD"
    },
    "limit": {
      "minorUnits": 5000,
      "currency": "USD"
    },
    "remaining": {
      "minorUnits": 3760,
      "currency": "USD"
    },
    "usedPercent": 24.8,
    "projectedTotal": null,
    "status": "ok"
  },
  "weekTotal": {
    "period": "week",
    "spent": {
      "minorUnits": 7130,
      "currency": "USD"
    },
    "limit": {
      "minorUnits": 25000,
      "currency": "USD"
    },
    "remaining": {
      "minorUnits": 17870,
      "currency": "USD"
    },
    "usedPercent": 28.52,
    "projectedTotal": {
      "minorUnits": 22800,
      "currency": "USD"
    },
    "status": "ok"
  },
  "monthTotal": {
    "period": "month",
    "spent": {
      "minorUnits": 21210,
      "currency": "USD"
    },
    "limit": {
      "minorUnits": 80000,
      "currency": "USD"
    },
    "remaining": {
      "minorUnits": 58790,
      "currency": "USD"
    },
    "usedPercent": 26.5125,
    "projectedTotal": {
      "minorUnits": 74200,
      "currency": "USD"
    },
    "status": "ok"
  },
  "alerts": [],
  "watchSummary": {
    "todayUsedPercent": 24.8,
    "weekUsedPercent": 28.52,
    "status": "ok"
  }
}
