{
  "generatedAt": "2026-06-27T18:42:00Z",
  "overallStatus": "ok",
  "accounts": [],
  "todayTotal": {
    "period": "today",
    "spent": { "minorUnits": 1240, "currency": "USD" },
    "limit": null,
    "remaining": null,
    "usedPercent": null,
    "projectedTotal": null,
    "status": "unknown"
  },
  "weekTotal": {
    "period": "week",
    "spent": { "minorUnits": 7130, "currency": "USD" },
    "limit": null,
    "remaining": null,
    "usedPercent": null,
    "projectedTotal": { "minorUnits": 22800, "currency": "USD" },
    "status": "unknown"
  },
  "monthTotal": {
    "period": "month",
    "spent": { "minorUnits": 21210, "currency": "USD" },
    "limit": null,
    "remaining": null,
    "usedPercent": null,
    "projectedTotal": { "minorUnits": 74200, "currency": "USD" },
    "status": "unknown"
  },
  "alerts": [],
  "watchSummary": {
    "todayUsedPercent": null,
    "weekUsedPercent": null,
    "status": "ok"
  }
}
